{"chain":"eip155:1","deployment":"wildcat-v2-hooksfactory","evidence_classes":["boundary-blocks","logs","traces"],"finality":{"block_hash":"0x1cfd09b6dfaa2af921e367d94f24e2b1e6b7f910a7a6f4276576f09aeb3f5cb9","block_number":"26022093","policy":"finalized"},"format":"alexandria-interval-plan/v2","interval":{"end":"26022093","start":"21866550"},"provider":{"class":"local reth archive node, trace-enabled, loopback","page_limit":100000,"timeout_seconds":3600},"shard_width":1200,"shards":[{"end":21867749,"index":0,"start":21866550},{"end":21868949,"index":1,"start":21867750},{"end":21870149,"index":2,"start":21868950},{"end":21871349,"index":3,"start":21870150},{"end":21872549,"index":4,"start":21871350},{"end":21873749,"index":5,"start":21872550},{"end":21874949,"index":6,"start":21873750},{"end":21876149,"index":7,"start":21874950},{"end":21877349,"index":8,"start":21876150},{"end":21878549,"index":9,"start":21877350},{"end":21879749,"index":10,"start":21878550},{"end":21880949,"index":11,"start":21879750},{"end":21882149,"index":12,"start":21880950},{"end":21883349,"index":13,"start":21882150},{"end":21884549,"index":14,"start":21883350},{"end":21885749,"index":15,"start":21884550},{"end":21886949,"index":16,"start":21885750},{"end":21888149,"index":17,"start":21886950},{"end":21889349,"index":18,"start":21888150},{"end":21890549,"index":19,"start":21889350},{"end":21891749,"index":20,"start":21890550},{"end":21892949,"index":21,"start":21891750},{"end":21894149,"index":22,"start":21892950},{"end":21895349,"index":23,"start":21894150},{"end":21896549,"index":24,"start":21895350},{"end":21897749,"index":25,"start":21896550},{"end":21898949,"index":26,"start":21897750},{"end":21900149,"index":27,"start":21898950},{"end":21901349,"index":28,"start":21900150},{"end":21902549,"index":29,"start":21901350},{"end":21903749,"index":30,"start":21902550},{"end":21904949,"index":31,"start":21903750},{"end":21906149,"index":32,"start":21904950},{"end":21907349,"index":33,"start":21906150},{"end":21908549,"index":34,"start":21907350},{"end":21909749,"index":35,"start":21908550},{"end":21910949,"index":36,"start":21909750},{"end":21912149,"index":37,"start":21910950},{"end":21913349,"index":38,"start":21912150},{"end":21914549,"index":39,"start":21913350},{"end":21915749,"index":40,"start":21914550},{"end":21916949,"index":41,"start":21915750},{"end":21918149,"index":42,"start":21916950},{"end":21919349,"index":43,"start":21918150},{"end":21920549,"index":44,"start":21919350},{"end":21921749,"index":45,"start":21920550},{"end":21922949,"index":46,"start":21921750},{"end":21924149,"index":47,"start":21922950},{"end":21925349,"index":48,"start":21924150},{"end":21926549,"index":49,"start":21925350},{"end":21927749,"index":50,"start":21926550},{"end":21928949,"index":51,"start":21927750},{"end":21930149,"index":52,"start":21928950},{"end":21931349,"index":53,"start":21930150},{"end":21932549,"index":54,"start":21931350},{"end":21933749,"index":55,"start":21932550},{"end":21934949,"index":56,"start":21933750},{"end":21936149,"index":57,"start":21934950},{"end":21937349,"index":58,"start":21936150},{"end":21938549,"index":59,"start":21937350},{"end":21939749,"index":60,"start":21938550},{"end":21940949,"index":61,"start":21939750},{"end":21942149,"index":62,"start":21940950},{"end":21943349,"index":63,"start":21942150},{"end":21944549,"index":64,"start":21943350},{"end":21945749,"index":65,"start":21944550},{"end":21946949,"index":66,"start":21945750},{"end":21948149,"index":67,"start":21946950},{"end":21949349,"index":68,"start":21948150},{"end":21950549,"index":69,"start":21949350},{"end":21951749,"index":70,"start":21950550},{"end":21952949,"index":71,"start":21951750},{"end":21954149,"index":72,"start":21952950},{"end":21955349,"index":73,"start":21954150},{"end":21956549,"index":74,"start":21955350},{"end":21957749,"index":75,"start":21956550},{"end":21958949,"index":76,"start":21957750},{"end":21960149,"index":77,"start":21958950},{"end":21961349,"index":78,"start":21960150},{"end":21962549,"index":79,"start":21961350},{"end":21963749,"index":80,"start":21962550},{"end":21964949,"index":81,"start":21963750},{"end":21966149,"index":82,"start":21964950},{"end":21967349,"index":83,"start":21966150},{"end":21968549,"index":84,"start":21967350},{"end":21969749,"index":85,"start":21968550},{"end":21970949,"index":86,"start":21969750},{"end":21972149,"index":87,"start":21970950},{"end":21973349,"index":88,"start":21972150},{"end":21974549,"index":89,"start":21973350},{"end":21975749,"index":90,"start":21974550},{"end":21976949,"index":91,"start":21975750},{"end":21978149,"index":92,"start":21976950},{"end":21979349,"index":93,"start":21978150},{"end":21980549,"index":94,"start":21979350},{"end":21981749,"index":95,"start":21980550},{"end":21982949,"index":96,"start":21981750},{"end":21984149,"index":97,"start":21982950},{"end":21985349,"index":98,"start":21984150},{"end":21986549,"index":99,"start":21985350},{"end":21987749,"index":100,"start":21986550},{"end":21988949,"index":101,"start":21987750},{"end":21990149,"index":102,"start":21988950},{"end":21991349,"index":103,"start":21990150},{"end":21992549,"index":104,"start":21991350},{"end":21993749,"index":105,"start":21992550},{"end":21994949,"index":106,"start":21993750},{"end":21996149,"index":107,"start":21994950},{"end":21997349,"index":108,"start":21996150},{"end":21998549,"index":109,"start":21997350},{"end":21999749,"index":110,"start":21998550},{"end":22000949,"index":111,"start":21999750},{"end":22002149,"index":112,"start":22000950},{"end":22003349,"index":113,"start":22002150},{"end":22004549,"index":114,"start":22003350},{"end":22005749,"index":115,"start":22004550},{"end":22006949,"index":116,"start":22005750},{"end":22008149,"index":117,"start":22006950},{"end":22009349,"index":118,"start":22008150},{"end":22010549,"index":119,"start":22009350},{"end":22011749,"index":120,"start":22010550},{"end":22012949,"index":121,"start":22011750},{"end":22014149,"index":122,"start":22012950},{"end":22015349,"index":123,"start":22014150},{"end":22016549,"index":124,"start":22015350},{"end":22017749,"index":125,"start":22016550},{"end":22018949,"index":126,"start":22017750},{"end":22020149,"index":127,"start":22018950},{"end":22021349,"index":128,"start":22020150},{"end":22022549,"index":129,"start":22021350},{"end":22023749,"index":130,"start":22022550},{"end":22024949,"index":131,"start":22023750},{"end":22026149,"index":132,"start":22024950},{"end":22027349,"index":133,"start":22026150},{"end":22028549,"index":134,"start":22027350},{"end":22029749,"index":135,"start":22028550},{"end":22030949,"index":136,"start":22029750},{"end":22032149,"index":137,"start":22030950},{"end":22033349,"index":138,"start":22032150},{"end":22034549,"index":139,"start":22033350},{"end":22035749,"index":140,"start":22034550},{"end":22036949,"index":141,"start":22035750},{"end":22038149,"index":142,"start":22036950},{"end":22039349,"index":143,"start":22038150},{"end":22040549,"index":144,"start":22039350},{"end":22041749,"index":145,"start":22040550},{"end":22042949,"index":146,"start":22041750},{"end":22044149,"index":147,"start":22042950},{"end":22045349,"index":148,"start":22044150},{"end":22046549,"index":149,"start":22045350},{"end":22047749,"index":150,"start":22046550},{"end":22048949,"index":151,"start":22047750},{"end":22050149,"index":152,"start":22048950},{"end":22051349,"index":153,"start":22050150},{"end":22052549,"index":154,"start":22051350},{"end":22053749,"index":155,"start":22052550},{"end":22054949,"index":156,"start":22053750},{"end":22056149,"index":157,"start":22054950},{"end":22057349,"index":158,"start":22056150},{"end":22058549,"index":159,"start":22057350},{"end":22059749,"index":160,"start":22058550},{"end":22060949,"index":161,"start":22059750},{"end":22062149,"index":162,"start":22060950},{"end":22063349,"index":163,"start":22062150},{"end":22064549,"index":164,"start":22063350},{"end":22065749,"index":165,"start":22064550},{"end":22066949,"index":166,"start":22065750},{"end":22068149,"index":167,"start":22066950},{"end":22069349,"index":168,"start":22068150},{"end":22070549,"index":169,"start":22069350},{"end":22071749,"index":170,"start":22070550},{"end":22072949,"index":171,"start":22071750},{"end":22074149,"index":172,"start":22072950},{"end":22075349,"index":173,"start":22074150},{"end":22076549,"index":174,"start":22075350},{"end":22077749,"index":175,"start":22076550},{"end":22078949,"index":176,"start":22077750},{"end":22080149,"index":177,"start":22078950},{"end":22081349,"index":178,"start":22080150},{"end":22082549,"index":179,"start":22081350},{"end":22083749,"index":180,"start":22082550},{"end":22084949,"index":181,"start":22083750},{"end":22086149,"index":182,"start":22084950},{"end":22087349,"index":183,"start":22086150},{"end":22088549,"index":184,"start":22087350},{"end":22089749,"index":185,"start":22088550},{"end":22090949,"index":186,"start":22089750},{"end":22092149,"index":187,"start":22090950},{"end":22093349,"index":188,"start":22092150},{"end":22094549,"index":189,"start":22093350},{"end":22095749,"index":190,"start":22094550},{"end":22096949,"index":191,"start":22095750},{"end":22098149,"index":192,"start":22096950},{"end":22099349,"index":193,"start":22098150},{"end":22100549,"index":194,"start":22099350},{"end":22101749,"index":195,"start":22100550},{"end":22102949,"index":196,"start":22101750},{"end":22104149,"index":197,"start":22102950},{"end":22105349,"index":198,"start":22104150},{"end":22106549,"index":199,"start":22105350},{"end":22107749,"index":200,"start":22106550},{"end":22108949,"index":201,"start":22107750},{"end":22110149,"index":202,"start":22108950},{"end":22111349,"index":203,"start":22110150},{"end":22112549,"index":204,"start":22111350},{"end":22113749,"index":205,"start":22112550},{"end":22114949,"index":206,"start":22113750},{"end":22116149,"index":207,"start":22114950},{"end":22117349,"index":208,"start":22116150},{"end":2